title,subhead,url,premium,article_type,image_url,byline
Somaliland's high-risk quest for recognition,"The self-proclaimed republic aspires to accede to the international stage. It finds itself at the center of a game of alliances, caught between Israeli, American and Emirati ambitions and threats from Yemen and neighboring Somalia.",https://www.lemonde.fr/en/le-monde-africa/visuel/2026/07/06/somaliland-s-high-risk-quest-for-recognition_6755178_124.html,True,article--main,https://img.lemde.fr/2026/04/17/0/277/834/556/800/533/75/0/d45b9ef_upload-1-rlyoptcq4o8u-plan-de-travail-3mediaappel2.png,
how le pen and bardella are wooing french and foreign diplomats,,https://www.lemonde.fr/en/international/article/2026/07/06/how-le-pen-and-bardella-are-wooing-french-and-foreign-diplomats_6755191_4.html,True,article--headlines,https://img.lemde.fr/2026/07/03/0/0/4321/2881/398/265/75/0/b403fcd_upload-1-nw9unumra1rc-000-37xe363.jpg,
resigned le pen puts on brave face before crucial court decision,,https://www.lemonde.fr/en/politics/article/2026/07/06/resigned-le-pen-puts-on-brave-face-before-crucial-court-decision_6755180_5.html,True,article--headlines,https://img.lemde.fr/2026/07/05/0/0/6000/4000/398/265/75/0/0a2a4d1_upload-1-1f6wbilk2qcb-cbi1322016.jpg,
what comes next will be just as grueling villagers remain anxious after wildfire in southern france,A wildfire fanned by fierce winds amid extreme heat consumed 540 hectares of scrubland in the Gard department within a matter of hours.,https://www.lemonde.fr/en/environment/article/2026/07/06/what-comes-next-will-be-just-as-grueling-villagers-remain-anxious-after-wildfire-in-southern-france_6755186_114.html,True,article--runner,https://img.lemde.fr/2026/07/05/0/0/3072/2048/398/265/75/0/4553e20_upload-1-lwc15yaull4s-maxnewsspecialtwo658066.jpg,
russia launches deadly barrage on kyiv region on eve of nato summit,Monday's assault was the second on the capital in less than a week. At least 10 people were killed and dozens wounded.,https://www.lemonde.fr/en/international/article/2026/07/06/russia-launches-deadly-barrage-on-kyiv-region-on-eve-of-nato-summit_6755179_4.html,False,article--runner,https://img.lemde.fr/2026/07/06/0/0/5203/3468/398/265/75/0/5b655d9_ftp-1-abnf8ed8qadx-5545659-01-06.jpg,
you can get good latin american food in paris here s where,"From colorful market stalls to a welcoming restaurant dining room, here is our selection of places to discover Colombian, Argentinian or Brazilian dishes in Paris.",https://www.lemonde.fr/en/food/article/2026/07/05/you-can-get-good-latin-american-food-in-paris-here-s-where_6755168_119.html,True,article--runner,https://img.lemde.fr/2026/06/26/473/0/3677/2451/398/265/75/0/40de086_upload-1-r275qlwivvxl-arepa-de-huevo.jpeg,
politicial scientist alexandra de hoop scheffer the us is pursuing a strategy of strategic saturation,"According to the president of the German Marshall Fund, the US, who is engaged on multiple fronts, is renegotiating the transatlantic contract unilaterally by pressuring its European allies to take responsibility for their own security. This 'burden shifting' challenges Europe to coordinate the organization of its defense industries.",https://www.lemonde.fr/en/international/article/2026/07/06/politicial-scientist-alexandra-de-hoop-scheffer-the-us-is-pursuing-a-strategy-of-strategic-saturation_6755177_4.html,True,Interview,https://img.lemde.fr/2026/07/02/840/0/2363/1575/1328/885/45/0/9462a4d_upload-1-z1lo2v8iepvg-mark-dion-between-voltaire-and-poe-hd-rafaele-fanelli-de-toure-rvb.jpg,Piotr Smolar
2026 world cup balogun suspension overturned after trump intervention,,https://www.lemonde.fr/en/sports/article/2026/07/06/2026-world-cup-balogun-suspension-overturned-after-trump-intervention_6755192_9.html,True,article--river,https://img.lemde.fr/2026/07/02/0/0/2397/1598/205/136/60/0/0b3ae60_ftp-1-paaviy337tnd-81fae20e76c74a0e9f7c539a2389e735-0-f64220102ca34b5db95825fa943b9fec.jpg,
clavicular an american masculinist in paris gets rejected,,https://www.lemonde.fr/en/m-le-mag/article/2026/07/05/clavicular-an-american-masculinist-in-paris-gets-rejected_6755167_117.html,True,article--river,https://img.lemde.fr/2026/06/30/63/0/1500/1000/205/136/60/0/365942b_ftp-1-lgrr1e7toykv-434287-3488570.jpg,
tour de france s third stage to go ahead without spectators due to wildfires,,https://www.lemonde.fr/en/sports/article/2026/07/06/tour-de-france-s-third-stage-to-go-ahead-without-spectators-due-to-wildfires_6755189_9.html,False,article--river,https://img.lemde.fr/2026/07/06/0/0/5500/3666/205/136/60/0/2f87547_ftp-1-ezsiqphve0i2-2026-07-06t064625z-968034102-rc268maog2pw-rtrmadp-3-europe-weather-france-wildfire.JPG,
masked gang steal jewels worth millions in french museum burglary,,https://www.lemonde.fr/en/france/article/2026/07/06/masked-gang-steal-jewels-worth-millions-in-french-museum-burglary_6755182_7.html,False,article--river,https://img.lemde.fr/2026/07/05/0/22/2956/1971/205/136/60/0/810bec4_ftp-1-5bcsxfztvc34-5541043-01-06.jpg,
netanyahu says some lebanese christian villages asked to be annexed by israel,,https://www.lemonde.fr/en/international/article/2026/07/05/netanyahu-says-some-lebanese-christian-villages-asked-to-be-annexed-by-israel_6755174_4.html,False,article--river,,
white supremacist march in dc just messy democracy official says,,https://www.lemonde.fr/en/international/article/2026/07/06/white-supremacist-march-in-dc-just-messy-democracy-official-says_6755176_4.html,False,article--river,,
as venezuela quake death toll tops 3 300 dozens of unidentified bodies buried,,https://www.lemonde.fr/en/environment/article/2026/07/06/as-venezuela-quake-death-toll-tops-3-300-dozens-of-unidentified-bodies-buried_6755183_114.html,False,article--river,,
philosopher melanie plouviez the rich are not rich alone they are in a social world that protects them,,https://www.lemonde.fr/en/opinion/article/2026/07/05/philosopher-melanie-plouviez-the-rich-are-not-rich-alone-they-are-in-a-social-world-that-protects-them_6755173_23.html,True,article--river,,
pope leo xiv visits lampedusa delivers powerful and symbolic message to protect migrants,,https://www.lemonde.fr/en/international/article/2026/07/05/pope-leo-xiv-visits-lampedusa-delivers-powerful-and-symbolic-message-to-protect-migrants_6755169_4.html,True,article--river,,
french courts spoil bernard arnault s american weekend,,https://www.lemonde.fr/en/economy/article/2026/07/06/french-courts-spoil-bernard-arnault-s-american-weekend_6755193_19.html,False,article--river,,
climate change we cannot meet the challenge of adapting housing with the tools of the past a thorough overhaul is needed,,https://www.lemonde.fr/en/economy/article/2026/07/04/climate-change-we-cannot-meet-the-challenge-of-adapting-housing-with-the-tools-of-the-past-a-thorough-overhaul-is-needed_6755153_19.html,True,article--river,,
250 years of american independence trump praises us and attacks communists at chaotic celebration,,https://www.lemonde.fr/en/international/article/2026/07/05/250-years-of-american-independence-trump-praises-us-and-attacks-communists-at-chaotic-celebration_6755164_4.html,True,article--river,,
250 years of american independence how the text that founded the us and changed the world was drafted,"'America 250' (1/13). The 13 colonies had been fighting the British Crown for a year when, in July 1776, lawyer Thomas Jefferson completed the drafting of the Declaration of Independence. Adopted by Congress on July 4 in Philadelphia, this document, which established the principle of equality for all – even though slavery was still legal everywhere – founded the United States of America.",https://www.lemonde.fr/en/international/article/2026/06/22/250-years-of-american-independence-how-the-text-that-founded-the-us-and-changed-the-world-was-drafted_6754757_4.html,True,Series,https://img.lemde.fr/2026/06/19/467/0/10121/6747/1328/885/45/0/71684ce_upload-1-gu3z5d9wjrsp-episode1-master-pnp-pga-02300-02322u.jpg,Corine Lesnes
we sacrificed everything in nablus the relentless decline of palestinian society,"In the occupied West Bank, Israel's financial stranglehold on the Palestinian Authority, combined with the proliferation of military checkpoints, has pushed society into unprecedented poverty. In Nablus, the economic heart of the occupied territory, all sectors have faced a sharp decline in living standards.",https://www.lemonde.fr/en/international/article/2026/07/05/we-sacrificed-everything-in-nablus-the-relentless-decline-of-palestinian-society_6755157_4.html,True,Feature,https://img.lemde.fr/2026/06/30/463/0/3298/2198/1328/885/45/0/7124d9c_upload-1-x6flnj53esn5-ll-naplouse-crise-eco-cisjordanie-50.jpg,Lucien Lung and  Marie Jo Sader
vladimir putin or the loneliness of homo sovieticus,"Between denial of reality, a desire for revenge and carefully crafted messaging, the Russian president has tried to position himself as the master of the game. But after more than four years of war in Ukraine, these old tricks inherited from the Soviet past are showing their limitations, and he is losing credibility.",https://www.lemonde.fr/en/international/article/2026/07/05/vladimir-putin-or-the-loneliness-of-homo-sovieticus_6755172_4.html,True,Long Read,https://img.lemde.fr/2026/06/22/0/0/6000/4000/1328/885/45/0/8a5368f_upload-1-rztcakfyvjwj-015.JPG,Marie Jégo
diverse france that of kylian mbappe and the national team is too promising a reality to be used as an electoral punching bag,,https://www.lemonde.fr/en/opinion/article/2026/07/05/diverse-france-that-of-kylian-mbappe-and-the-national-team-is-too-promising-a-reality-to-be-used-as-an-electoral-punching-bag_6755175_23.html,True,Column,,
timothy snyder historian trump s war against iran shows that evil and folly can march hand in hand,,https://www.lemonde.fr/en/opinion/article/2026/07/03/timothy-snyder-historian-trump-s-war-against-iran-shows-that-evil-and-folly-can-march-hand-in-hand_6755112_23.html,True,Op-Ed,,
a typology of france s presidential candidates,,https://www.lemonde.fr/en/opinion/article/2026/07/02/a-typology-of-france-s-presidential-candidates_6755080_23.html,True,Column,,
